WKT,id,tipo,ubicacion,direccion,horario,observ_pri,calle,altura,cruce,dom_norma,dom_geo
"POINT (-58.3759555851374 -34.6221988758339)","1",punto verde fijo,Plaza Rosario Vera Peñaloza,Av. San Juan y Chacabuco,Miércoles a Domingo de 11 a 19 hs.,,San Juan,,Chacabuco,SAN JUAN AV. y CHACABUCO,SAN JUAN AV. & CHACABUCO
"POINT (-58.3838707119237 -34.5979695453983)","2",punto verde fijo,Plaza Libertad,Paraguay y Libertad,Miércoles a Domingo de 11 a 19 hs.,,Paraguay,,Libertad,PARAGUAY y LIBERTAD,PARAGUAY & LIBERTAD
"POINT (-58.391410856937 -34.5988220083475)","3",punto verde fijo,Plaza Petronila Rodríguez,Rodriguez Peña y Paraguay,Miércoles a Domingo de 11 a 19 hs.,,Rodriguez Peña,,Paraguay,RODRIGUEZ PEÑA y PARAGUAY,RODRIGUEZ PEÑA & PARAGUAY
"POINT (-58.3967997943963 -34.5880099838196)","4",punto verde fijo,Plaza Emilio Mitre,Av. General Las Heras y Cantilo,Miércoles a Domingo de 11 a 19 hs.,,General Las Heras,,Cantilo,LAS HERAS GENERAL AV. y CANTILO,LAS HERAS GENERAL AV. & CANTILO
"POINT (-58.4078380584346 -34.5979170075104)","5",punto verde fijo,Plaza Monseñor De Andrea,Anchorena y Av. Córdoba,Miércoles a Domingo de 11 a 19 hs.,,Anchorena,,Córdoba,"ANCHORENA, TOMAS MANUEL DE, DR. y CORDOBA AV.","ANCHORENA, TOMAS MANUEL DE, DR. & CORDOBA AV."
"POINT (-58.4085449547963 -34.6260546776409)","6",punto verde fijo,Plaza Martín Fierro,General Urquiza y Cochabamba,Miércoles a Domingo de 11 a 19 hs.,,General Urquiza,,Cochabamba,"URQUIZA, GRAL. y COCHABAMBA","URQUIZA, GRAL. & COCHABAMBA"
"POINT (-58.4038163711591 -34.6172212185082)","7",punto verde fijo,Plaza José María Velazco Ibarra,Av. Jujuy y México,Miércoles a Domingo de 11 a 19 hs.,,Jujuy,,México,JUJUY AV. y MEXICO,JUJUY AV. & MEXICO
"POINT (-58.3673738487152 -34.6399997868503)","8",punto verde fijo,Plaza Matheu,General Araoz Lamadrid y Hernandarias,Miércoles a Domingo de 11 a 19 hs.,,General Araoz de Lamadrid,,Hernandarias,"ARAOZ DE LAMADRID, GREGORIO, GRAL. y HERNANDARIAS","ARAOZ DE LAMADRID, GREGORIO, GRAL. & HERNANDARIAS"
"POINT (-58.415956143186 -34.6520678653934)","9",punto verde fijo,Plaza Nueva Pompeya,Av. Saenz y Traful,Miércoles a Domingo de 11 a 19 hs.,,Saenz,,Traful,SAENZ AV. y TRAFUL,SAENZ AV. & TRAFUL
"POINT (-58.392446786065 -34.6275975673969)","10",punto verde fijo,Polo Circo,Av. Juan de Garay y Pichincha,Miércoles a Domingo de 11 a 19 hs.,,Juan de Garay,,Combate de los Pozos,"GARAY, JUAN DE AV. y COMBATE DE LOS POZOS","GARAY, JUAN DE AV. & COMBATE DE LOS POZOS"
"POINT (-58.3745181944477 -34.6377222742358)","11",punto verde fijo,Plaza Colombia,Av. Montes de Oca y Brandsen,Miércoles a Domingo de 11 a 19 hs.,,Montes de Oca,,Brandsen,"MONTES DE OCA, MANUEL AV. y BRANDSEN","MONTES DE OCA, MANUEL AV. & BRANDSEN"
"POINT (-58.3875432183949 -34.651092484806)","12",punto verde fijo,Parque Leonardo Pereyra,Velez Sarfield e Iriarte,Miércoles a Domingo de 11 a 19 hs.,,Iriarte,,Luzuriaga,"IRIARTE, GRAL.AV. y LUZURIAGA","IRIARTE, GRAL. AV. & LUZURIAGA"
"POINT (-58.4186664305948 -34.6054904812543)","13",punto verde fijo,Plaza Almagro,Sarmiento y Bulnes,Miércoles a Domingo de 11 a 19 hs.,,Sarmiento,,Bulnes,SARMIENTO y BULNES,SARMIENTO & BULNES
"POINT (-58.4124357593728 -34.6228206143552)","14",punto verde fijo,Plaza Boedo,Estados Unidos y Sanchez de Loria,Miércoles a Domingo de 11 a 19 hs.,,Carlos Calvo,,Sánchez de Loria,CARLOS CALVO y SANCHEZ DE LORIA,CARLOS CALVO & SANCHEZ DE LORIA
"POINT (-58.4590204660647 -34.6139323481204)","15",punto verde fijo,Plaza Irlanda,Donato Alvarez y Gaona,Miércoles a Domingo de 11 a 19 hs.,,Donato Alvarez,,Gaona,"ALVAREZ, DONATO, TTE. GRAL. y GAONA AV.","ALVAREZ, DONATO, TTE. GRAL. & GAONA AV."
"POINT (-58.4323521520016 -34.616676684127)","16",punto verde fijo,Parque Rivadavia,Av. Rivadavia y Florencio Balcarce,Miércoles a Domingo de 11 a 19 hs.,,Rivadavia,,Doblas,RIVADAVIA AV. y DOBLAS,RIVADAVIA AV. & DOBLAS
"POINT (-58.4412296539415 -34.6171692360487)","17",punto verde fijo,Plaza Giordano Bruno,Giordano Bruno y Parral,Miércoles a Domingo de 11 a 19 hs.,,Giordano Bruno,,Colpayo,"BRUNO, GIORDANO y COLPAYO","BRUNO, GIORDANO & COLPAYO"
"POINT (-58.4432700561256 -34.6128525056378)","18",punto verde fijo,Plaza Amadeo Sabattini,Colpayo y Vallese,Miércoles a Domingo de 11 a 19 hs.,,Colpayo,,Vallese,"COLPAYO y VALLESE, FELIPE","COLPAYO & VALLESE, FELIPE"
"POINT (-58.4572521467758 -34.6218555060599)","19",punto verde fijo,Plaza Ángel Gris,Av. Avellaneda y Cálcena,Miércoles a Domingo de 11 a 19 hs.,,Avellaneda,,Cálcena,AVELLANEDA AV. y CALCENA,AVELLANEDA AV. & CALCENA
"POINT (-58.4423102779229 -34.6312950548491)","20",punto verde fijo,Parque Chacabuco,Av. Asamblea y Puán,Miércoles a Domingo de 11 a 19 hs.,,Eva Perón,,Emilio Mkitre,"PERON, EVA AV. y MITRE, EMILIO","PERON, EVA AV. & MITRE, EMILIO"
"POINT (-58.4736448217738 -34.6212609291512)","21",punto verde fijo,Plaza de los Periodistas,Nazca y Neuquén,Miércoles a Domingo de 11 a 19 hs.,,Nazca,,Neuquén,NAZCA AV. y NEUQUEN,NAZCA AV. & NEUQUEN
"POINT (-58.4635681903127 -34.6345271666227)","22",punto verde fijo,Plaza 11 de Noviembre,Av. Directorio e Italia,Miércoles a Domingo de 11 a 19 hs.,,Directorio,,Varela,DIRECTORIO AV. y VARELA,DIRECTORIO AV. & VARELA
"POINT (-58.45630724996 -34.6322742850742)","23",punto verde fijo,Plaza de la Misericordia,Lautaro y Francisco Bilbao,Miércoles a Domingo de 11 a 19 hs.,,Directorio,,Camacuá,DIRECTORIO y CAMACUA,DIRECTORIO & CAMACUA
"POINT (-58.4643626146963 -34.62821080172)","24",punto verde fijo,Plaza Pueyrredón,Yerbal y Artigas,Miércoles a Domingo de 11 a 19 hs.,,Yerbal,,Artigas,"YERBAL y ARTIGAS, JOSE GERVASIO, GRAL.","YERBAL & ARTIGAS, JOSE GERVASIO, GRAL."
"POINT (-58.4443740801873 -34.6506344840626)","25",punto verde fijo,Punto Verde Villa 1.11.14,https://goo.gl/maps/SNRenCj6mYEE7Xve7,Lunes a Viernes de 10 a 18 hs.,https://goo.gl/maps/SNRenCj6mYEE7Xve7,Perito Moreno,,Riestra,"VILLA 1-11-14 - BARRIO PADRE RICCIARDELLI, MZA. 12","VILLA 1-11-14, BARRIO PADRE RICCIARDELLI, MZA. 12"
"POINT (-58.4770431524332 -34.6772052078372)","26",punto verde fijo,Estación Lugano,Delfin Gallo y Martiniano Leguizamon,Miércoles a Domingo de 11 a 19 hs.,,Delfín Gallo,,Martiniano Leguizamón,"GALLO, DELFIN y LEGUIZAMON, MARTINIANO","GALLO, DELFIN & LEGUIZAMON, MARTINIANO"
"POINT (-58.4753530056924 -34.6878593044704)","27",punto verde fijo,Plaza Sudamérica,Av. Piedra Buena y Av. Fernandez de la Cruz,Miércoles a Domingo de 11 a 19 hs.,,Piedra Buena,,Fernández de la Cruz,"PIEDRA BUENA AV. y FERNANDEZ DE LA CRUZ, F., GRAL. AV.","PIEDRA BUENA AV. & FERNANDEZ DE LA CRUZ, F., GRAL. AV."
"POINT (-58.4698156033675 -34.6644145998121)","28",punto verde fijo,Plaza Calabria,Escalada y Castañares,Miércoles a Domingo de 11 a 19 hs.,,Escalada,,Castañares,ESCALADA AV. y CASTAÑARES AV.,ESCALADA AV. & CASTAÑARES AV.
"POINT (-58.4661321641662 -34.6819286431506)","29",punto verde fijo,Punto Verde Lugano 1 y 2,Gral. Conrado Villegas 5555,Miércoles a Domingo de 11 a 19 hs.,,General Conrado Villegas,"5555",,"VILLEGAS, CONRADO, GRAL. 5555","5555 VILLEGAS, CONRADO, GRAL."
"POINT (-58.527040600178 -34.650884502585)","30",punto verde fijo,Plaza Sargento Cabral,José León Suarez y Martinez de Hoz,Miércoles a Domingo de 11 a 19 hs.,,José León Suarez,,Martínez de Hoz,"SUAREZ, JOSE LEON y MARTINEZ DE HOZ","SUAREZ, JOSE LEON & MARTINEZ DE HOZ"
"POINT (-58.480018802217 -34.641662650398)","31",punto verde fijo,Parque Avellaneda,Av. Directorio y Fernandez,Miércoles a Domingo de 11 a 19 hs.,,Directorio,,Lacarra,DIRECTORIO AV. y LACARRA,DIRECTORIO AV. & LACARRA
"POINT (-58.4839472761327 -34.6470838098219)","32",punto verde fijo,Plaza Domingo Olivera,Av. Domingo Olivera 824,Miércoles a Domingo de 11 a 19 hs.,,Olivera,"824",,OLIVERA AV. 824,824 OLIVERA AV.
"POINT (-58.5205300750041 -34.657316498279)","33",punto verde fijo,Plaza Rómulo Zabala,Ercilla 7502,Miércoles a Domingo de 11 a 19 hs.,,Ercilla,"7502",,ERCILLA 7502,7502 ERCILLA
"POINT (-58.5142650964045 -34.6472622454575)","34",punto verde fijo,Parque Santojanni,Acassuso y Pilar,Miércoles a Domingo de 11 a 19 hs.,,Patrón,,Murguiondo,PATRON y MURGUIONDO,PATRON & MURGUIONDO
"POINT (-58.5207027491542 -34.6279123073906)","35",punto verde fijo,Plaza Ciudad de Banff,Arregui y Lisboa,Miércoles a Domingo de 11 a 19 hs.,,Arregui,,Lisboa,ARREGUI AV. y LISBOA,ARREGUI AV. & LISBOA
"POINT (-58.5083625845248 -34.6190395844419)","36",punto verde fijo,Plaza Monseñor Fermín Lafitte,Desaguadero e Hilario de Almeira,Miércoles a Domingo de 11 a 19 hs.,,Desaguadero,,Hilario de Almeira,"DESAGUADERO y ALMEIRA, HILARIO DE","DESAGUADERO & ALMEIRA, HILARIO DE"
"POINT (-58.5083333847335 -34.6265643662456)","37",punto verde fijo,Plaza Don Bosco,Av. Lope de Vega y Elpidio Gonzalez,Miércoles a Domingo de 11 a 19 hs.,,Lope de Vega,,Elpidio González,"LOPE DE VEGA AV. y GONZALEZ, ELPIDIO","LOPE DE VEGA AV. & GONZALEZ, ELPIDIO"
"POINT (-58.4927795384163 -34.6286005442283)","38",punto verde fijo,Plaza de la Bandera,Av. Juan B. Justo y Gaona,Miércoles a Domingo de 11 a 19 hs.,,Gaona,,Belén,GAONA y BELEN,GAONA & BELEN
"POINT (-58.5261405987902 -34.6164910215134)","39",punto verde fijo,Plaza Toscaneras de Villa Real,Ramón Lista y Moliere,Miércoles a Domingo de 11 a 19 hs.,,Ramón Lista,,Moliere,"LISTA, RAMON, CORONEL y MOLIERE","LISTA, RAMON, CORONEL & MOLIERE"
"POINT (-58.4834619393981 -34.62958907791)","40",punto verde fijo,Plaza Vélez Sarsfield,Av. Avellaneda y Chivilcoy,Miércoles a Domingo de 11 a 19 hs.,,Avellaneda,,Chivilcoy,AVELLANEDA AV. y CHIVILCOY,AVELLANEDA AV. & CHIVILCOY
"POINT (-58.4826343694876 -34.6356068457062)","41",punto verde fijo,Plaza Ramón Falcón,Falcon y De Benedetti,Miércoles a Domingo de 11 a 19 hs.,,Falcón,,de Benedetti,"FALCON, RAMON L.,CNEL. y BENEDETTI, OSVALDO E., DIP.NAC.","FALCON, RAMON L.,CNEL. & BENEDETTI, OSVALDO E., DIP.NAC."
"POINT (-58.4923593441799 -34.6202718118603)","42",punto verde fijo,Plaza Ciudad de Udine,Chivilcoy y Camarones,Miércoles a Domingo de 11 a 19 hs.,,Chivilcoy,,Camarones,CHIVILCOY y CAMARONES,CHIVILCOY & CAMARONES
"POINT (-58.4982021137305 -34.6180791064729)","43",punto verde fijo,Plaza Monte Castro,Gualeguaychu y Miranda,Miércoles a Domingo de 11 a 19 hs.,,Gualeguaychú,,Miranda,GUALEGUAYCHU y MIRANDA,GUALEGUAYCHU & MIRANDA
"POINT (-58.4683784473677 -34.6104125284448)","44",punto verde fijo,Plaza Dr. Roque Sáenz Peña,Remedios de Escalada y Boyacá,Miércoles a Domingo de 11 a 19 hs.,,Remedios de Escalada,,Boyacá,"ESCALADA DE SAN MARTIN, R. y BOYACA","ESCALADA DE SAN MARTIN, R. & BOYACA"
"POINT (-58.523267248712 -34.6130599882787)","45",punto verde fijo,Plaza El Maestro,Av. Francisco Beiró y Pedro Calderón de la Barca,Miércoles a Domingo de 11 a 19 hs.,,Francisco Beiró,,Calderón de la Barca,"BEIRO, FRANCISCO AV. y CALDERON DE LA BARCA, PEDRO","BEIRO, FRANCISCO AV. & CALDERON DE LA BARCA, PEDRO"
"POINT (-58.4926588386468 -34.6049566121151)","46",punto verde fijo,Plaza Aristóbulo del Valle,Campana y Baigorria,Miércoles a Domingo de 11 a 19 hs.,,Cuenca,,Baigorria,CUENCA y BAIGORRIA,CUENCA & BAIGORRIA
"POINT (-58.5128782417243 -34.5988775226469)","47",punto verde fijo,Plaza Arenales,Mercedes y Nueva York,Miércoles a Domingo de 11 a 19 hs.,,Chivilcoy,,Pareja,CHIVILCOY y PAREJA,CHIVILCOY & PAREJA
"POINT (-58.4750950852499 -34.5730422715525)","48",punto verde fijo,Plaza Zapiola,Juramento y Donado,Miércoles a Domingo de 11 a 19 hs.,,Juramento,,Donado,JURAMENTO y DONADO,JURAMENTO & DONADO
"POINT (-58.489694598962 -34.5718974536827)","49",punto verde fijo,Plaza Echeverría,Nahuel Huapi y Triunvirato,Miércoles a Domingo de 11 a 19 hs.,,Nahuel Huspí,,Triunvirato,NAHUEL HUAPI y TRIUNVIRATO AV.,NAHUEL HUAPI & TRIUNVIRATO AV.
"POINT (-58.5038554871281 -34.5763063077286)","50",punto verde fijo,Plaza Leandro N. Alem,Artigas y Larsen,Miércoles a Domingo de 11 a 19 hs.,,Artigas,,Larsen,"ARTIGAS, JOSE GERVASIO GRAL. y LARSEN","ARTIGAS, JOSE GERVASIO GRAL. & LARSEN"
"POINT (-58.4773820773596 -34.5502958671783)","51",punto verde fijo,Parque Saavedra,Roque Perez y Pairoissien,Miércoles a Domingo de 11 a 19 hs.,,García del Río,,Pinto,GARCIA DEL RIO y PINTO,GARCIA DEL RIO & PINTO
"POINT (-58.4865407050065 -34.5603470455878)","52",punto verde fijo,Plaza Alberdi,Larralde y Mariano Acha,Miércoles a Domingo de 11 a 19 hs.,,Nuñez,,Machaín,NUÑEZ y MACHAIN,NUÑEZ & MACHAIN
"POINT (-58.4773820773596 -34.5502958671783)","53",punto verde fijo,Parque Saavedra 2,Av. Garcia del Rio y Pinto,Miércoles a Domingo de 11 a 19 hs.,,García del Río,,Pinto,GARCIA DEL RIO y PINTO,GARCIA DEL RIO & PINTO
"POINT (-58.5008100059648 -34.5902289214736)","54",punto verde fijo,Plaza Martín Rodríguez,Habana y Argerich,Miércoles a Domingo de 11 a 19 hs.,,Habana,,Argerich,HABANA y ARGERICH,HABANA & ARGERICH
"POINT (-58.4647031538262 -34.5679795816465)","55",punto verde fijo,Plaza Castelli,Juramento y Conde,Miércoles a Domingo de 11 a 19 hs.,,Echeverría,,Conde,ECHEVERRIA y CONDE,ECHEVERRIA & CONDE
"POINT (-58.4579738793639 -34.5772972845627)","56",punto verde fijo,Plaza San Miguel de Garicoits,Delgado y Virrey Loreto,Miércoles a Domingo de 11 a 19 hs.,,Delgado,,Virrey Loreto,"DELGADO y LORETO, VIRREY","DELGADO & LORETO, VIRREY"
"POINT (-58.4548134614003 -34.5611619216332)","57",punto verde fijo,Plaza Manuel Belgrano,Cuba y Juramento,Miércoles a Domingo de 11 a 19 hs.,,Cuba,,Juramento,CUBA y JURAMENTO AV.,CUBA & JURAMENTO AV.
"POINT (-58.4462160754602 -34.5806257461236)","58",punto verde fijo,Plaza Mafalda,Santos Dumont y Gral. Enrique Martinez,Miércoles a Domingo de 11 a 19 hs.,,Santos Dumont,,General Enrique Martínez,"DUMONT, SANTOS y MARTINEZ, ENRIQUE, GRAL.","DUMONT, SANTOS & MARTINEZ, ENRIQUE, GRAL."
"POINT (-58.4683902640225 -34.5470746394295)","59",punto verde fijo,Plaza Balcarce,Manzanares y Vuelta de Obligado,Miércoles a Domingo de 11 a 19 hs.,,Manzanares,,Vuelta de Obligado,MANZANARES y VUELTA DE OBLIGADO,MANZANARES & VUELTA DE OBLIGADO
"POINT (-58.4422203965839 -34.5491314644123)","60",punto verde fijo,Paseo de las Américas,Ramsay y Blanco Encalada,Miércoles a Domingo de 11 a 19 hs.,,Ramsay,,Blanco Encalada,RAMSAY y BLANCO ENCALADA,RAMSAY & BLANCO ENCALADA
"POINT (-58.4158910874189 -34.5892554634509)","61",punto verde fijo,Plaza Güemes,Medrano y Charcas,Miércoles a Domingo de 11 a 19 hs.,,Medrano,,Charcas,MEDRANO y CHARCAS,MEDRANO & CHARCAS
"POINT (-58.4100502044229 -34.5824851798699)","62",punto verde fijo,Parque Las Heras,Salguero 2450,Miércoles a Domingo de 11 a 19 hs.,,Las Heras,,Jerónimo Salguero,"LAS HERAS GENERAL AV. y SALGUERO, JERONIMO","LAS HERAS GENERAL AV. & SALGUERO, JERONIMO"
"POINT (-58.4250902420823 -34.5893150456802)","63",punto verde fijo,Plaza Palermo Viejo,Malabia y Costa Rica,Miércoles a Domingo de 11 a 19 hs.,,Malabia,,Costa Rica,MALABIA y COSTA RICA,MALABIA & COSTA RICA
"POINT (-58.4045610379833 -34.576484799103)","64",punto verde fijo,Plaza República de Perú,Av. Figueroa Alcorta y Jerónimo Salguero,Miércoles a Domingo de 11 a 19 hs.,,Figueroa Alcorta,,Jerónimo Salguero,"FIGUEROA ALCORTA, PRES. AV. y SALGUERO, JERONIMO","FIGUEROA ALCORTA, PRES. AV. & SALGUERO, JERONIMO"
"POINT (-58.4506163673924 -34.5892213272789)","65",punto verde fijo,Parque Los Andes,Av. Dorrego y Av. Guzman,Miércoles a Domingo de 11 a 19 hs.,,Corrientes,,Santos Dumont,"CORRIENTES AV. y DUMONT, SANTOS","CORRIENTES AV. & DUMONT, SANTOS"
"POINT (-58.4630770311445 -34.5797541862166)","66",punto verde fijo,Plaza 25 de agosto,Charlone y Heredia,Miércoles a Domingo de 11 a 19 hs.,,Giribone,,Heredia,GIRIBONE y HEREDIA,GIRIBONE & HEREDIA
"POINT (-58.4449658656695 -34.6049567321642)","67",punto verde fijo,Plaza Benito Nazar,Antezana y Olaya,Miércoles a Domingo de 11 a 19 hs.,,Antezana,,Olaya,ANTEZANA y OLAYA,ANTEZANA & OLAYA
"POINT (-58.484768783373 -34.5879486519741)","68",punto verde fijo,Plaza Nobel,Bucarest y Hamburgo,Miércoles a Domingo de 11 a 19 hs.,,Bucarest,,Hamburgo,BUCAREST y HAMBURGO,BUCAREST & HAMBURGO
"POINT (-58.4548306107401 -34.584550881864)","69",punto verde fijo,Plaza Forest (Roberto J. Santoro),Forest y Teodoro García,Miércoles a Domingo de 11 a 19 hs.,,Forest,,Teodoro García,"FOREST AV. y GARCIA, TEODORO","FOREST AV. & GARCIA, TEODORO"
"POINT (-58.405957849575 -34.6373874536884)","70",punto verde fijo,Parque Patricios,Uspallata y Monteagudo,Miércoles a Domingo de 11 a 19 hs.,,Caseros,,Monteagudo,CASEROS y MONTEAGUDO,CASEROS & MONTEAGUDO
"POINT (-58.462399538711 -34.5488954557894)","71",punto verde fijo,Estación Núñez,Grecia y Manuela Pedraza,Miércoles a Domingo de 11 a 19 hs.,,Grecia,,Manuela Pedraza,"GRECIA y PEDRAZA, MANUELA","GRECIA & PEDRAZA, MANUELA"
"POINT (-58.3975955515258 -34.6109298716703)","72",punto verde fijo,Plaza 1ro de Mayo,Hipólito Yrigoyen y Pasco,Miércoles a Domingo de 11 a 19 hs.,,Hipólito Yrigoyen,,Pasco,"YRIGOYEN, HIPOLITO y PASCO","YRIGOYEN, HIPOLITO & PASCO"
"POINT (-58.3940922496837 -34.6353308387784)","73",punto verde fijo,Parque Florentino Ameghino,Caseros y Monasterio,Miércoles a Domingo de 11 a 19 hs.,,Caseros,,Santa Cruz,CASEROS AV. y SANTA CRUZ,CASEROS AV. & SANTA CRUZ
"POINT (-58.4676123301009 -34.6642253307704)","74",punto movil,PVM 1,https://goo.gl/maps/95EWmzo497Hcyrht5,Martes a Domingo de 10 a 18 hs,https://goo.gl/maps/95EWmzo497Hcyrht5,Castañares,,Escalada,CASTAÑARES AV. y ESCALADA AV.,CASTAÑARES AV. & ESCALADA AV.
"POINT (-58.4676123301009 -34.6642253307704)","75",punto movil,PVM 2,https://goo.gl/maps/95EWmzo497Hcyrht5,Martes a Domingo de 10 a 18 hs,https://goo.gl/maps/95EWmzo497Hcyrht5,Castañares,,Escalada,CASTAÑARES AV. y ESCALADA AV.,CASTAÑARES AV. & ESCALADA AV.
"POINT (-58.4676123301009 -34.6642253307704)","76",punto movil,PVM 3,https://goo.gl/maps/95EWmzo497Hcyrht5,Martes a Domingo de 10 a 18 hs,https://goo.gl/maps/95EWmzo497Hcyrht5,Castañares,,Escalada,CASTAÑARES AV. y ESCALADA AV.,CASTAÑARES AV. & ESCALADA AV.
"POINT (-58.4676123301009 -34.6642253307704)","77",punto movil,PVM 4,https://goo.gl/maps/95EWmzo497Hcyrht5,Martes a Domingo de 10 a 18 hs,https://goo.gl/maps/95EWmzo497Hcyrht5,Castañares,,Escalada,CASTAÑARES AV. y ESCALADA AV.,CASTAÑARES AV. & ESCALADA AV.
"POINT (-58.4676123301009 -34.6642253307704)","78",punto movil,PVM FJ,https://goo.gl/maps/95EWmzo497Hcyrht5,Martes a Domingo de 10 a 18 hs,https://goo.gl/maps/95EWmzo497Hcyrht5,Castañares,,Escalada,CASTAÑARES AV. y ESCALADA,CASTAÑARES AV. & ESCALADA AV.
"POINT (-58.3693519590452 -34.6207493527146)","79",sede comunal,Sede Comunal 1,Humberto Primo 250,Lunes a Viernes de 8 a 15 hs.,,Humberto Primo,"250",,HUMBERTO 1° 250,250 HUMBERTO 1°
"POINT (-58.4246545167381 -34.6503271118299)","80",sede comunal,Sede Comunal 4,Av. del Barco Centenera 2906,Lunes a Viernes de 8 a 15 hs.,,Av. Del Barco Centenera,"2906",,BARCO CENTENERA DEL 2906,2906 BARCO CENTENERA DEL
"POINT (-58.4551407673022 -34.6848681942033)","81",sede comunal,Sede Comunal 8,Av. Cnel. Roca 5252,Lunes a Viernes de 8 a 15 hs.,,Av. Cnel. Roca,"5252",,"ROCA, CNEL. AV. 5252","5252 ROCA, CNEL. AV."
"POINT (-58.5049837209995 -34.6596157956251)","82",sede comunal,Sede Comunal 9,Timoteo Gordillo 2212,Lunes a Viernes de 8 a 15 hs.,,Timoteo Gordillo,"2212",,"GORDILLO, TIMOTEO 2212","2212 GORDILLO, TIMOTEO"
"POINT (-58.4835309765186 -34.6319050109826)","83",sede comunal,Sede Comunal 10,Bacacay 3968,Lunes a Viernes de 8 a 15 hs.,,Bacacay,"3968",,BACACAY 3968,3968 BACACAY
"POINT (-58.4777802024934 -34.5685684896424)","84",sede comunal,Sede Comunal 12,Holmberg 2548,Lunes a Viernes de 8 a 15 hs.,,Holmberg,"2548",,HOLMBERG 2548,2548 HOLMBERG
"POINT (-58.4093055042834 -34.5871585692008)","85",sede comunal,Sede Comunal 14,Beruti 3325,Lunes a Viernes de 8 a 15 hs.,,Beruti,"3325",,BERUTI 3325,3325 BERUTI
"POINT (-58.4414400896233 -34.5870408892038)","86",sede comunal,Sede Comunal 15,Av. Córdoba 5690,Lunes a Viernes de 8 a 15 hs.,,Córdoba,"5690",,CORDOBA AV. 5690,5690 CORDOBA AV.
"POINT (-58.4550471525991 -34.6560413646328)","87",portal,Portal Barrio Ramón Carrillo,Av. Mariano Acosta y Pasaje I.,Lunes a viernes de 8 a 15 hs.,,Mariano Acoata,,Pasaje I,MARIANO ACOSTA y PASAJE I,MARIANO ACOSTA & PASAJE I
"POINT (-58.4933772862601 -34.6779784930658)","88",portal,Portal Barrio Piedrabuena,José León Suárez 3893,Viernes de 10 a 15 hs.,,José León Suárez,"3893",,"SUAREZ, JOSE LEON 3893","3893 SUAREZ, JOSE LEON"
"POINT (-58.4002444232831 -34.6560962158627)","89",portal,Portal Barrio 21-24,Av. Osvaldo Cruz 3657,Lunes a viernes de 8:30 a 15:30 hs.,,Osvaldo Cruz,"3657",,"CRUZ, OSVALDO 3657","3657 CRUZ, OSVALDO"
"POINT (-58.461493381586 -34.671811294715)","90",portal,Portal Barrio 20,Avenida General Francisco Fernández de la Cruz & Miralla,"Lunes, martes y viernes de 10:30 a 13:30 hs.",,Escalada,"3745",,ESCALADA AV. 3745,3745 ESCALADA AV.
"POINT (-58.4332481136715 -34.6506859363868)","91",portal,Portal Barrio 1.11.14,Avenida Riestra & Avenida Coronel Esteban Bonorino,Lunes a Viernes de 9 a 16 hs.,,Perito Moreno,,Erezcano,"MORENO, PERITO AV. y EREZCANO","MORENO, PERITO AV. & EREZCANO"
"POINT (-58.4952666388396 -34.6702573796346)","92",portal,Portal Barrio 15,Av. Piedra Buena 3124,Lunes a Viernes de 9 a 16 hs.,,Piedra B uena,"3124",,PIEDRA BUENA AV. 3124,3124 PIEDRA BUENA AV.
"POINT (-58.371363638515 -34.6279676330709)","93",portal,C.Peralles - IVC,Dr. Enrique Finochietto 435,Lunes a Viernes 09:30 a 14 hs.,,Dr. Enrique Finochietto,"435",,FINOCHIETTO ENRIQUE DR. 435,435 FINOCHIETTO ENRIQUE DR.
"POINT (-58.3555058235081 -34.6185493637871)","94",portal,Portal Rodrigo Bueno,Av. España 1800,Lunes a viernes de 9 a 16 hs.,,Av. España,"1800",,ESPAÑA AV. 1800,1800 ESPAÑA AV.
"POINT (-58.3800932195354 -34.5842378257095)","95",portal,Portal Barrio 31,https://goo.gl/maps/tsUhUypy3Ny2d6c18,Lunes a viernes de 9 a 16 hs.,https://goo.gl/maps/tsUhUypy3Ny2d6c18,Calle 10,,Del Inmigrante,"VILLA 31 BIS, GALPON","VILLA 31 BIS, GALPON"
"POINT (-58.4473425508069 -34.6485060689241)","96",portal,Portal Cildañez,Av. Varela 1950,"Lunes a Viernes, 09:30 a 16:30 hs.",https://goo.gl/maps/MBNpFkrrErKyoHx16,Av. Varela,"1950",,VARELA AV. 1950,1950 VARELA AV.
"POINT (-58.443742901251 -34.6651879149854)","97",portal,Portal Soldati,Corrales 3491,"Lunes a Viernes, 9 a 20 hs.",https://goo.gl/maps/qw7bpaMpMQM8QGRS9,Corrales,"3491",,CORRALES 3491,3491 CORRALES
"POINT (-58.4870796577495 -34.68392774821)","98",otro punto,Comedor Ositos Cariñosos,https://goo.gl/maps/gcDvdA5Vdas5ZxV16,Lunes a Viernes de 9 a 17 hs.,https://goo.gl/maps/gcDvdA5Vdas5ZxV16,Del Palo Santo,,Los Robles,DEL PALO SANTO y LOS ROBLES,DEL PALO SANTO & LOS ROBLES
"POINT (-58.4554319260271 -34.5865624316523)","99",otro punto,Mutual Sentimiento,Av. Federico Lacroze 4181,Lunes a Viernes 10 a 19 hs.,,Av. Federico Lacroze,"4181",,"LACROZE, FEDERICO AV. 4181","4181 LACROZE, FEDERICO AV."
"POINT (-58.443438245829 -34.6710485023577)","100",otro punto,Parque Roca,Av. Cnel. Roca 4700,Martes a Viernes 9 a 16 hs.,,Av. Cnel. Roca,,Lacarra,"ROCA, CNEL. AV. y LACARRA AV.","ROCA, CNEL. AV. & LACARRA AV.."
"POINT (-58.4632115777947 -34.6888055954224)","101",otro punto,OBRADOR IVC,Berón de Astrada 5960,Martes y Jueves 10 a 14 hs.,,Berón de Astrada,"5960",,BERON DE ASTRADA 5960,5960 BERON DE ASTRADA
